{
  "schemaVersion": "1.0.0",
  "documentId": "layout:00-source:semantic",
  "source": {
    "layoutDocumentId": "layout:00-source",
    "filePath": "C:\\Users\\tabur\\PDFIsAbsurd\\OpenAutoTag\\tmp\\calibration-corpus\\pipeline-artifacts\\un-ga-hebrew\\00-source.pdf",
    "language": "en-US",
    "languageConfidence": 0.99
  },
  "nodes": [
    {
      "id": "n-1-2",
      "pageNumber": 1,
      "sourceBlockId": "p1-b2",
      "role": "P",
      "text": "United Nations /RES/78/205",
      "bbox": [
        123.38,
        43.80000000000003,
        428.66995999999995,
        14.04
      ],
      "columnHint": 0,
      "confidence": 0.88,
      "sourceBlockType": "paragraph",
      "regionKind": null,
      "_mergedFrom": [
        "n-1-2",
        "n-1-3"
      ],
      "paragraphGroupId": "pg-1-0",
      "readingOrder": 1
    },
    {
      "id": "n-1-5",
      "pageNumber": 1,
      "sourceBlockId": "p1-b5",
      "role": "P",
      "text": "Distr.: General 22 December 2023",
      "bbox": [
        397.03,
        76.69999999999996,
        80.89511999999996,
        21.72
      ],
      "columnHint": 0,
      "confidence": 0.88,
      "sourceBlockType": "paragraph",
      "regionKind": null,
      "_mergedFrom": [
        "n-1-5",
        "n-1-6"
      ],
      "paragraphGroupId": "pg-1-1",
      "readingOrder": 3
    },
    {
      "id": "n-1-7",
      "pageNumber": 1,
      "sourceBlockId": "p1-b7",
      "role": "P",
      "text": "Seventy-eighth session Agenda item 71 (b) Promotion and protection of human rights: human rights questions, including alternative approaches for improving the effective enjoyment of human rights and fundamental freedoms",
      "bbox": [
        60,
        212.29999999999998,
        264.7783033199999,
        69.99000000000004
      ],
      "columnHint": 0,
      "confidence": 0.88,
      "sourceBlockType": "paragraph",
      "regionKind": null,
      "_mergedFrom": [
        "n-1-7",
        "n-1-8",
        "n-1-9",
        "n-1-10",
        "n-1-11",
        "n-1-12"
      ],
      "paragraphGroupId": "pg-1-2",
      "readingOrder": 4
    },
    {
      "id": "n-1-13",
      "pageNumber": 1,
      "sourceBlockId": "p1-b13",
      "role": "P",
      "text": "Resolution adopted by the General Assembly on 19 December 2023",
      "bbox": [
        123.38,
        300.65,
        290.13940799999995,
        29.04000000000002
      ],
      "columnHint": 0,
      "confidence": 0.88,
      "sourceBlockType": "paragraph",
      "regionKind": null,
      "_mergedFrom": [
        "n-1-13",
        "n-1-14"
      ],
      "paragraphGroupId": "pg-1-3",
      "readingOrder": 5
    },
    {
      "id": "n-1-15",
      "pageNumber": 1,
      "sourceBlockId": "p1-b15",
      "role": "P",
      "text": "[on the report of the Third Committee (A/78/481/Add.2, para. 139)]",
      "bbox": [
        123.38,
        344.33000000000004,
        287.40668000000005,
        9.95999999999998
      ],
      "columnHint": 0,
      "confidence": 0.88,
      "sourceBlockType": "paragraph",
      "regionKind": null,
      "paragraphGroupId": "pg-1-4",
      "readingOrder": 6
    },
    {
      "id": "n-1-16",
      "pageNumber": 1,
      "sourceBlockId": "p1-b16",
      "role": "P",
      "text": "78/205. Protection of and assistance to internally displaced persons",
      "bbox": [
        72.384,
        367.49,
        372.37769119999956,
        12
      ],
      "columnHint": 0,
      "confidence": 0.88,
      "sourceBlockType": "paragraph",
      "regionKind": null,
      "paragraphGroupId": "pg-1-5",
      "readingOrder": 7
    },
    {
      "id": "n-1-17",
      "pageNumber": 1,
      "sourceBlockId": "p1-b17",
      "role": "P",
      "text": "The General Assembly,",
      "bbox": [
        147.14,
        394.01000000000005,
        99.48000000000002,
        9.95999999999998
      ],
      "columnHint": 0,
      "confidence": 0.88,
      "sourceBlockType": "paragraph",
      "regionKind": null,
      "paragraphGroupId": "pg-1-6",
      "readingOrder": 8
    },
    {
      "id": "n-1-18",
      "pageNumber": 1,
      "sourceBlockId": "p1-b18",
      "role": "P",
      "text": "Guided by the purposes and principles of the Charter of the United Nations,",
      "bbox": [
        147.14,
        412.03000000000003,
        325.74911999999983,
        9.95999999999998
      ],
      "columnHint": 0,
      "confidence": 0.88,
      "sourceBlockType": "paragraph",
      "regionKind": null,
      "paragraphGroupId": "pg-1-7",
      "readingOrder": 9
    },
    {
      "id": "n-1-19",
      "pageNumber": 1,
      "sourceBlockId": "p1-b19",
      "role": "P",
      "text": "Recalling that internally displaced persons are persons or groups of persons who have been forced or obliged to flee or to leave their homes or places of habitual residence, in particular as a result of or in order to avoid the effects of armed conflict, situations of generalized violence, violations of human rights or natural or human- 1 made disasters, and who have not crossed an internationally recognized State border,",
      "bbox": [
        123.38,
        430.03000000000003,
        365.36,
        57.95999999999998
      ],
      "columnHint": 0,
      "confidence": 0.88,
      "sourceBlockType": "paragraph",
      "regionKind": null,
      "_mergedFrom": [
        "n-1-19",
        "n-1-20",
        "n-1-21",
        "n-1-22",
        "n-1-23",
        "n-1-24"
      ],
      "paragraphGroupId": "pg-1-8",
      "readingOrder": 10
    },
    {
      "id": "n-1-25",
      "pageNumber": 1,
      "sourceBlockId": "p1-b25",
      "role": "P",
      "text": "Deeply disturbed by the alarmingly high numbers of internally displaced persons throughout the world, for reasons including violations and abuses of human rights and violations of international humanitarian law, armed conflict, persecution, violence and other reasons, including terrorism, as well as natural and human-made disasters, who receive inadequate protection and assistance, and conscious of the serious challenges that this is creating for host communities, national and local authorities and the international community,",
      "bbox": [
        123.38,
        496.03000000000003,
        365.06863999999996,
        81.95999999999998
      ],
      "columnHint": 0,
      "confidence": 0.88,
      "sourceBlockType": "paragraph",
      "regionKind": null,
      "_mergedFrom": [
        "n-1-25",
        "n-1-26",
        "n-1-27",
        "n-1-28",
        "n-1-29",
        "n-1-30",
        "n-1-31"
      ],
      "paragraphGroupId": "pg-1-9",
      "readingOrder": 11
    },
    {
      "id": "n-1-32",
      "pageNumber": 1,
      "sourceBlockId": "p1-b32",
      "role": "P",
      "text": "Recalling the very large number of people who are displaced within national borders and the potential for such persons to seek protection and assistance in other countries as refugees or migrants, and noting the need for reflection on effective strategies to ensure adequate protection and assistance for internally displaced persons in this regard, including the need for comprehensive and disaggregated data and other measures aimed at preventing and reducing such displacements,",
      "bbox": [
        123.38,
        586.06,
        364.30320000000006,
        69.96000000000004
      ],
      "columnHint": 0,
      "confidence": 0.88,
      "sourceBlockType": "paragraph",
      "regionKind": null,
      "_mergedFrom": [
        "n-1-32",
        "n-1-33",
        "n-1-34",
        "n-1-35",
        "n-1-36",
        "n-1-37"
      ],
      "paragraphGroupId": "pg-1-10",
      "readingOrder": 12
    },
    {
      "id": "n-1-38",
      "pageNumber": 1,
      "sourceBlockId": "p1-b38",
      "role": "P",
      "text": "__________________",
      "bbox": [
        99.624,
        671.02,
        72.03036000000006,
        8.039999999999964
      ],
      "columnHint": 0,
      "confidence": 0.88,
      "sourceBlockType": "paragraph",
      "regionKind": null,
      "paragraphGroupId": "pg-1-11",
      "readingOrder": 13
    },
    {
      "id": "n-1-39",
      "pageNumber": 1,
      "sourceBlockId": "p1-b39",
      "role": "P",
      "text": "See Guiding Principles on Internal Displacement (E/CN.4/1998/53/Add.2, annex), introduction, 1",
      "bbox": [
        117.02,
        684.696,
        364.5043999999997,
        8.519999999999982
      ],
      "columnHint": 0,
      "confidence": 0.88,
      "sourceBlockType": "paragraph",
      "regionKind": null,
      "_mergedFrom": [
        "n-1-39",
        "n-1-40"
      ],
      "paragraphGroupId": "pg-1-12",
      "readingOrder": 14
    },
    {
      "id": "n-1-41",
      "pageNumber": 1,
      "sourceBlockId": "p1-b41",
      "role": "P",
      "text": "para. 2.",
      "bbox": [
        123.38,
        695.256,
        27.511079999999993,
        8.519999999999982
      ],
      "columnHint": 0,
      "confidence": 0.88,
      "sourceBlockType": "paragraph",
      "regionKind": null,
      "paragraphGroupId": "pg-1-13",
      "readingOrder": 15
    },
    {
      "id": "n-1-42",
      "pageNumber": 1,
      "sourceBlockId": "p1-b42",
      "role": "P",
      "text": "23-26026 (E) 090124 *2326026*",
      "bbox": [
        65.424,
        737.616,
        101.172,
        24.624000000000024
      ],
      "columnHint": 0,
      "confidence": 0.88,
      "sourceBlockType": "paragraph",
      "regionKind": null,
      "_mergedFrom": [
        "n-1-42",
        "n-1-43"
      ],
      "paragraphGroupId": "pg-1-14",
      "readingOrder": 16
    },
    {
      "id": "n-1-1",
      "pageNumber": 1,
      "sourceBlockId": "p1-b1",
      "role": "H1",
      "text": "A",
      "bbox": [
        482.14,
        36.47999999999998,
        14.901499511999987,
        20.04
      ],
      "headingLevel": 1,
      "columnHint": 0,
      "confidence": 0.93,
      "sourceBlockType": "heading",
      "regionKind": null,